id;title;description;availability;condition;price;link;image_link;brand;google_product_category;fb_product_category;inventory;sale_price;sale_price_effective_date;item_group_id;gender;color;size;age_group;material;pattern;shipping;shipping_weight
25;Ripador de Fitas;;em stock;novo;4,16;;;;;;32;4,16;;;;;;;;;;
34;Palha de Papel - 1 kg;;em stock;novo;9,84;;;;;;314;9,84;;;;;;;;;;
38;Envelope Gift - Pack 25 un.;envelope gift, envelope liso;em stock;novo;11,69;;;;;;5;11,69;;;;;;;;;;
42;Envelope Gift Padrão - Pack 25 un;envelope gift, envelope padrão;em stock;novo;2,69;;;;;;30;2,69;;;;;;;;;;
45;Caixa Oval - Pack 25 un.;caixa oval, caixa cartolina;em stock;novo;9,69;;;;;;157;9,69;;;;;;;;;;
46;Caixa Cube;cube, cubo, caixa cube;em stock;novo;1,47;;;;;;42;1,47;;;;;;;;;;
47;Tabuleiro Leitão - Pack 25 un.;leitão, tabuleiro leitão;em stock;novo;18,88;;;;;;3;18,88;;;;;;;;;;
49;Caixa Gourmet - Pack 15 un.;caixa gourmet;em stock;novo;36,9;;;;;;17;36,9;;;;;;;;;;
50;Caixas Kraft Natural Garrafa - Pack 25 un.;caixa vinho, garrafa, caixa kraft;em stock;novo;11,6;;;;;;15;11,6;;;;;;;;;;
55;Caixa Garrafa Preto - Pack 25 un.;;em stock;novo;17,6;;;;;;4;17,6;;;;;;;;;;
57;Caixa Garrafa Canelado - Onda Avana - Pack 25 un.;caixa vinho, garrafa, caixa kraft;em stock;novo;21,81;;;;;;4;21,81;;;;;;;;;;
58;Caixa Garrafa em Preto com asa cordão - Pack 20 un.;caixa vinho, garrafa, caixa preta;em stock;novo;22,63;;;;;;9;22,63;;;;;;;;;;
59;Papel de Embrulho Fundo dourado com estrelas ouro e prata - Pack 25 un.;;em stock;novo;23,06;;;;;;0;23,06;;;;;;;;;;
60;Papel de Embrulho Cores Lisas - Pack 25 un.;;em stock;novo;23,06;;;;;;85;23,06;;;;;;;;;;
64;Papel de Embrulho fundo roxo com folhas rosa e ouro - Pack 25 un.;;em stock;novo;23,06;;;;;;16;23,06;;;;;;;;;;
65;Papel de Embrulho vermelho com folhas laranja e ouro - Pack 25 un.;;em stock;novo;23,06;;;;;;8;23,06;;;;;;;;;;
67;Papel de Embrulho fundo castanho com círculos prata - Pack de 25 un.;;em stock;novo;23,06;;;;;;1;23,06;;;;;;;;;;
69;Papel de Embrulho riscas em prata preto e cinza - Pack 25 un.;;em stock;novo;23,06;;;;;;8;23,06;;;;;;;;;;
72;Papel de Embrulho dourado com círculos - Pack 25 un.;;em stock;novo;23,06;;;;;;1;23,06;;;;;;;;;;
73;Papel de Embrulho fundo preto estrelas prata - Pack 25 un.;;em stock;novo;15,49;;;;;;3;15,49;;;;;;;;;;
74;Papel de Embrulho xadrez preto, ouro e beje - Pack 25 un.;;em stock;novo;23,06;;;;;;2;23,06;;;;;;;;;;
75;Papel de Embrulho roxo com estrelas prata e ouro - Pack 25 un.;;em stock;novo;23,06;;;;;;5;23,06;;;;;;;;;;
76;Papel de Embrulho dourado com estrela ouro e prata - Pack 25 un.;;em stock;novo;23,06;;;;;;0;23,06;;;;;;;;;;
77;Papel de Embrulho laranja com bonecos de neve - Pack 25 un.;;em stock;novo;23,06;;;;;;1;23,06;;;;;;;;;;
78;Papel de Embrulho azul com espirais e folhas - Pack 25 un.;;em stock;novo;10,77;;;;;;1;10,77;;;;;;;;;;
79;Papel de Embrulho animais da quinta - Pack 25 un.;;em stock;novo;15,49;;;;;;2;15,49;;;;;;;;;;
81;Papel de Embrulho bordeaux com linhas douradas - Pack 25 un.;;em stock;novo;23,06;;;;;;5;23,06;;;;;;;;;;
82;Papel de Embrulho rosa com padrão - Pack 25 un.;;em stock;novo;10,77;;;;;;3;10,77;;;;;;;;;;
83;Papel de Embrulho beja com padrão - Pack 25 un.;;em stock;novo;10,77;;;;;;1;10,77;;;;;;;;;;
84;Papel de Embrulho tons cinza com padrão - Pack 25 un.;;em stock;novo;15,49;;;;;;2;15,49;;;;;;;;;;
85;Papel de Embrulho laranja com padrão de gatos - Pack 25 un.;;em stock;novo;15,49;;;;;;10;15,49;;;;;;;;;;
86;Papel de Embrulho tons azuis com padrão - Pack 25 un.;;em stock;novo;23,06;;;;;;3;23,06;;;;;;;;;;
87;Papel de Embrulho verde com padrão - Pack 25 un.;;em stock;novo;23,06;;;;;;4;23,06;;;;;;;;;;
88;Papel de embrulho cinza escuro com padrão - Pack 25 un.;;em stock;novo;23,06;;;;;;23;23,06;;;;;;;;;;
90;Papel de Embrulho brilho - Pack 50 un.;;em stock;novo;23,38;;;;;;2;23,38;;;;;;;;;;
92;Papel de Embrulho riscas azuis - Pack 25 un.;papel embrulho, riscas;em stock;novo;10,77;;;;;;9;10,77;;;;;;;;;;
93;Papel de Embrulho riscas vermelho e ouro - Pack 25 un.;papel embrulho, riscas;em stock;novo;10,77;;;;;;9;10,77;;;;;;;;;;
94;Papel de Embrulho padrão floreado - Pack 25 un.;;em stock;novo;10,77;;;;;;15;10,77;;;;;;;;;;
96;Papel de Embrulho padrão multicolor - Pack 25 un.;papel embrulho, multicolor;em stock;novo;10,77;;;;;;9;10,77;;;;;;;;;;
97;Papel de Embrulho - Rolo propileno ouro 70 cm x 25 m;;em stock;novo;36,9;;;;;;6;36,9;;;;;;;;;;
98;Papel de Embrulho - Rolo cores planas - 70 cm x 100 m.;;em stock;novo;92,25;;;;;;13;92,25;;;;;;;;;;
99;Papel de Embrulho - Rolo cinza padrão e prata - 70 cm.;;em stock;novo;92,25;;;;;;1;92,25;;;;;;;;;;
100;Papel de Embrulho - Rolo com padrão 70 cm x 50 mt.;;em stock;novo;43,05;;;;;;5;43,05;;;;;;;;;;
101;Papel de Embrulho vermelho com padrão dourado - 70 cm x 100 mt.;;em stock;novo;92,25;;;;;;2;92,25;;;;;;;;;;
102;Papel de Embrulho - Rolo cinza com riscas brancas - 70 cm x 50 mt.;;em stock;novo;67,65;;;;;;1;67,65;;;;;;;;;;
103;Papel de embrulho - rolo branco com bolas douradas - 70 cm x 25 mt;;em stock;novo;36,9;;;;;;10;36,9;;;;;;;;;;
104;Papel de Embrulho - rolo prata brilho - 70 cm.;;em stock;novo;92,25;;;;;;2;92,25;;;;;;;;;;
106;Papel de Embrulho - Rolo branco com traços dourados - 70 cm.;;em stock;novo;92,25;;;;;;2;92,25;;;;;;;;;;
107;Papel de Embrulho - rolo rosa com bolas brancas - 70 cm x 50 mt.;;em stock;novo;67,65;;;;;;2;67,65;;;;;;;;;;
109;Papel de Embrulho - rolo padrão natal - 70 cm x 2 mt.;;em stock;novo;1,85;;;;;;48;1,85;;;;;;;;;;
111;Papel de Seda - Cores variadas - 50x70 cm (Resma);papel seda;em stock;novo;24,6;;;;;;48;24,6;;;;;;;;;;
112;Papel Sulfito - 60x80 cm (Resma);;em stock;novo;14,15;;;;;;5;14,15;;;;;;;;;;
116;Fita Brilho Amarelo;fita amarela, fita cor lisa;em stock;novo;2,21;;;;;;57;2,21;;;;;;;;;;
117;Fita Brilho Amarelo Torrado;fita amarela, fita cor lisa;em stock;novo;2,21;;;;;;94;2,21;;;;;;;;;;
118;Fita Brilho Bordeaux;fita cor lisa, fita bordeaux;em stock;novo;2,13;;;;;;106;2,13;;;;;;;;;;
119;Fita Brilho Castanho;fita cor lisa, fita castanha;em stock;novo;2,21;;;;;;24;2,21;;;;;;;;;;
120;Fita Brilho Laranja;fita cor lisa, fita laranja;em stock;novo;2,21;;;;;;52;2,21;;;;;;;;;;
121;Fita Brilho Laranja Claro;fita cor lisa, fita laranja;em stock;novo;2,21;;;;;;22;2,21;;;;;;;;;;
124;Fita Brilho Lilás;fita cor lisa, fita lilás;em stock;novo;2,13;;;;;;34;2,13;;;;;;;;;;
125;Fita Brilho Preta;;em stock;novo;2,21;;;;;;27;2,21;;;;;;;;;;
126;Fita Brilho Roxa;;em stock;novo;2,13;;;;;;4;2,13;;;;;;;;;;
127;Fita Brilho Verde;fita verde, fita cor lisa;em stock;novo;2,13;;;;;;37;2,13;;;;;;;;;;
128;Fita Brilho Verde Escuro;fita verde, fita cor lisa;em stock;novo;2,13;;;;;;6;2,13;;;;;;;;;;
129;Fita Brilho Verde Musgo;fita verde, fita cor lisa;em stock;novo;2,13;;;;;;16;2,13;;;;;;;;;;
130;Fita Brilho Coral;fita cor lisa, fita coral;em stock;novo;2,83;;;;;;6;2,83;;;;;;;;;;
132;Fita Brilho Azul Escuro;;em stock;novo;2,13;;;;;;26;2,13;;;;;;;;;;
134;Fita Brilho Azul Petróleo;;em stock;novo;2,21;;;;;;2;2,21;;;;;;;;;;
136;Fita Brilho Rosa;;em stock;novo;2,21;;;;;;6;2,21;;;;;;;;;;
137;Fita Brilho Verde Claro;;em stock;novo;2,21;;;;;;9;2,21;;;;;;;;;;
138;Fita Brilho Vermelho;;em stock;novo;2,21;;;;;;18;2,21;;;;;;;;;;
139;Fita Brilho Cinza;;em stock;novo;2,83;;;;;;3;2,83;;;;;;;;;;
140;Fita Brilho Prata;;em stock;novo;2,83;;;;;;3;2,83;;;;;;;;;;
141;Fita Brilho Azul Claro;;em stock;novo;2,21;;;;;;13;2,21;;;;;;;;;;
142;Fita Brilho Branca;;em stock;novo;2,21;;;;;;20;2,21;;;;;;;;;;
143;Fita Brilho Fuchsia;;em stock;novo;2,21;;;;;;19;2,21;;;;;;;;;;
144;Fita Brilho Verde Alface;;em stock;novo;2,21;;;;;;18;2,21;;;;;;;;;;
145;Fita Brilho Verde Tropa;;em stock;novo;2,21;;;;;;20;2,21;;;;;;;;;;
146;Fita Brilho Azul Turquesa;;em stock;novo;2,13;;;;;;20;2,13;;;;;;;;;;
149;Fita Padrão Riscado e Texturado;fita verde, fita padrão, textura, fita creme;em stock;novo;5,39;;;;;;28;5,39;;;;;;;;;;
150;Fita Padrão Quadrados e Rectangulos;fita padrão, fita azul, fita vermelha, fita ouro, fita rosa, fita fuchsia, fita lilás, quadrados;em stock;novo;6,25;;;;;;280;6,25;;;;;;;;;;
151;Fita Padrão Ondas;fita verde, fita padrão, fita vermelha, ondas;em stock;novo;8,47;;;;;;80;8,47;;;;;;;;;;
153;Fita Decorativa;fita ouro, fita prata;em stock;novo;11,27;;;;;;26;11,27;;;;;;;;;;
154;Fita Decorativa;fita ouro, fita prata;em stock;novo;12,89;;;;;;46;12,89;;;;;;;;;;
155;Fita Decorativa;fita ouro, fita prata;em stock;novo;13;;;;;;14;13;;;;;;;;;;
156;Fita Decorativa 25 mm x 25 mt;fita ouro;em stock;novo;16,19;;;;;;7;16,19;;;;;;;;;;
157;Fita Decorativa em rede 40 mm x 10 mt;fita ouro;em stock;novo;8,87;;;;;;2;8,87;;;;;;;;;;
158;Fita Decorativa Prasent 22 mm x 25 mt;fita ouro, fita prata;em stock;novo;16,19;;;;;;14;16,19;;;;;;;;;;
159;Fita Ecológica;fita verde, fita azul, fita rosa;em stock;novo;4,15;;;;;;88;4,15;;;;;;;;;;
160;Fita Mate Ouro Velho;;em stock;novo;5,47;;;;;;13;5,47;;;;;;;;;;
161;Fita Mate Azul Petróleo;;em stock;novo;5,26;;;;;;56;5,26;;;;;;;;;;
163;Fita Mate Azul Claro;fita azul, fita cor lisa;em stock;novo;5,26;;;;;;1;5,26;;;;;;;;;;
164;Fita Mate Castanha;fita cor lisa, fita castanha;em stock;novo;5,26;;;;;;3;5,26;;;;;;;;;;
165;Fita Mate Fuschia;fita cor lisa, fita fuchsia;em stock;novo;5,26;;;;;;6;5,26;;;;;;;;;;
170;Fita Mate Lilás;fita cor lisa, fita lilás;em stock;novo;5,26;;;;;;6;5,26;;;;;;;;;;
171;Fita Mate Rosa Velho;fita cor lisa, fita rosa;em stock;novo;5,26;;;;;;1;5,26;;;;;;;;;;
172;Fita Mate Verde;fita verde, fita cor lisa;em stock;novo;5,26;;;;;;2;5,26;;;;;;;;;;
173;Fita Mate Ouro Escuro;fita cor lisa, fita ouro;em stock;novo;4,87;;;;;;4;4,87;;;;;;;;;;
174;Fita Mate Ouro;fita cor lisa, fita ouro;em stock;novo;7;;;;;;3;7;;;;;;;;;;
175;Fita Mate Vermelha;fita cor lisa, fita vermelha;em stock;novo;7;;;;;;4;7;;;;;;;;;;
176;Fita Mate Prata;fita cor lisa, fita prata;em stock;novo;10,21;;;;;;2;10,21;;;;;;;;;;
178;Fita Metalizada Vermelha;fita cor lisa, fita vermelha;em stock;novo;6,33;;;;;;11;6,33;;;;;;;;;;
179;Fita Metalizada Azul Escuro;fita azul, fita cor lisa;em stock;novo;6,33;;;;;;6;6,33;;;;;;;;;;
180;Fita Metalizada Castanha;fita cor lisa, fita castanha;em stock;novo;6,33;;;;;;2;6,33;;;;;;;;;;
181;Fita Metalizada Fuschia;fita cor lisa, fita fuchsia;em stock;novo;6,33;;;;;;46;6,33;;;;;;;;;;
182;Fita Metalizada Prata;fita cor lisa, fita prata;em stock;novo;6,33;;;;;;58;6,33;;;;;;;;;;
183;Fita Metalizada Roxa;fita cor lisa, fita roxa;em stock;novo;6,33;;;;;;17;6,33;;;;;;;;;;
184;Fita Metalizada Verde;fita verde, fita cor lisa;em stock;novo;6,33;;;;;;6;6,33;;;;;;;;;;
187;Fita Metalizada Verde Escuro;fita verde, fita cor lisa;em stock;novo;6,33;;;;;;11;6,33;;;;;;;;;;
188;Fita Metalizada Rosa;fita cor lisa, fita rosa;em stock;novo;4,7;;;;;;2;4,7;;;;;;;;;;
189;Fita Padrão Vermelho;fita padrão, fita vermelha;em stock;novo;12,8;;;;;;5;12,8;;;;;;;;;;
190;Fita Metalizada Ouro;fita cor lisa, fita ouro;em stock;novo;6,33;;;;;;13;6,33;;;;;;;;;;
191;Fita Metalizada Azul Turquesa;fita azul, fita cor lisa;em stock;novo;4,7;;;;;;2;4,7;;;;;;;;;;
192;Fita Metalizada Lilás;fita cor lisa, fita lilás;em stock;novo;4,7;;;;;;15;4,7;;;;;;;;;;
193;Fita Padrão Prata com Corações;fita padrão, fita vermelha, fita prata;em stock;novo;8,54;;;;;;55;8,54;;;;;;;;;;
194;Fita Papel Azul Escuro;fita azul, fita cor lisa;em stock;novo;9,67;;;;;;30;9,67;;;;;;;;;;
195;Fita Papel Azul Petróleo;fita azul, fita cor lisa;em stock;novo;9,67;;;;;;32;9,67;;;;;;;;;;
196;Fita Papel Cinza;fita cor lisa, fita cinza;em stock;novo;9,67;;;;;;8;9,67;;;;;;;;;;
197;Fita Papel Ouro;fita cor lisa, fita ouro;em stock;novo;9,67;;;;;;63;9,67;;;;;;;;;;
198;Fita Papel Prata;fita cor lisa, fita prata;em stock;novo;9,67;;;;;;154;9,67;;;;;;;;;;
199;Fita Papel Preta;fita cor lisa, fita preta;em stock;novo;9,67;;;;;;81;9,67;;;;;;;;;;
200;Fita Papel Roxa;fita cor lisa, fita roxa;em stock;novo;9,67;;;;;;6;9,67;;;;;;;;;;
201;Fita Papel Verde Musgo;fita verde, fita cor lisa;em stock;novo;9,67;;;;;;14;9,67;;;;;;;;;;
202;Fita Papel Vermelha;fita cor lisa, fita vermelha;em stock;novo;9,67;;;;;;24;9,67;;;;;;;;;;
203;Fita Papel Vermelha Escura;fita cor lisa, fita vermelha;em stock;novo;9,67;;;;;;7;9,67;;;;;;;;;;
204;Fita Papel Lilás;fita cor lisa, fita lilás;em stock;novo;9,67;;;;;;26;9,67;;;;;;;;;;
205;Fita Papel Cobre;fita cor lisa, fita cobre;em stock;novo;8,98;;;;;;2;8,98;;;;;;;;;;
206;Fita Papel Bege;fita cor lisa, fita bege;em stock;novo;8,98;;;;;;3;8,98;;;;;;;;;;
207;Fita Papel Bordeaux;fita cor lisa, fita bordeaux;em stock;novo;8,98;;;;;;35;8,98;;;;;;;;;;
208;Fita Papel Verde;fita verde, fita cor lisa;em stock;novo;8,98;;;;;;7;8,98;;;;;;;;;;
209;Fita Papel Verde Escuro;fita verde, fita cor lisa;em stock;novo;8,98;;;;;;49;8,98;;;;;;;;;;
210;Fita Papel Vermelho Tijolo;fita cor lisa, fita vermelha;em stock;novo;8,98;;;;;;8;8,98;;;;;;;;;;
211;Fita Papel Azul Claro;fita azul, fita cor lisa;em stock;novo;9,67;;;;;;18;9,67;;;;;;;;;;
212;Fita Papel Rosa;fita cor lisa, fita rosa;em stock;novo;9,29;;;;;;37;9,29;;;;;;;;;;
213;Fita Papel Ouro Musgo;fita cor lisa, fita ouro;em stock;novo;9,67;;;;;;11;9,67;;;;;;;;;;
214;Fita Papel Branco;fita cor lisa, fita branca;em stock;novo;9,67;;;;;;38;9,67;;;;;;;;;;
216;Fita Papel Azul;fita azul, fita cor lisa;em stock;novo;9,29;;;;;;7;9,29;;;;;;;;;;
217;Fita Papel Rosa Claro;fita cor lisa;em stock;novo;9,29;;;;;;12;9,29;;;;;;;;;;
218;Fita Papel Verde Alface;fita verde, fita cor lisa;em stock;novo;9,29;;;;;;22;9,29;;;;;;;;;;
219;Fita Papel Verde Escuro;fita verde, fita cor lisa;em stock;novo;8,98;;;;;;22;8,98;;;;;;;;;;
220;Fita Papel Fuschia;fita cor lisa, fita fuchsia;em stock;novo;12,35;;;;;;17;12,35;;;;;;;;;;
221;Fita Papel Rosa Velho;fita cor lisa, fita rosa;em stock;novo;12,35;;;;;;1;12,35;;;;;;;;;;
222;Fita Wave Ouro;fita textura, fita ouro;em stock;novo;5,9;;;;;;232;5,9;;;;;;;;;;
223;Fita Wave Prata;fita textura, fita prata;em stock;novo;5,9;;;;;;285;5,9;;;;;;;;;;
225;Fita Wave Bordeaux;fita textura, fita bordeaux;em stock;novo;4,63;;;;;;123;4,63;;;;;;;;;;
226;Fita Wave Branca;fita textura, fita branca;em stock;novo;4,63;;;;;;9;4,63;;;;;;;;;;
227;Fita Wave Castanha;fita textura, fita castanha;em stock;novo;4,63;;;;;;8;4,63;;;;;;;;;;
228;Fita Wave Verde Escuro;fita verde, fita textura;em stock;novo;4,63;;;;;;52;4,63;;;;;;;;;;
229;Fita Wave Vermelha;fita textura, fita vermelha;em stock;novo;4,63;;;;;;62;4,63;;;;;;;;;;
231;Fita Ráfia Bege;;em stock;novo;6,99;;;;;;4;6,99;;;;;;;;;;
232;Fita Ráfia Verde;;em stock;novo;9,69;;;;;;13;9,69;;;;;;;;;;
235;Fita Ráfia Verde Escuro;;em stock;novo;4,49;;;;;;8;4,49;;;;;;;;;;
236;Fita Ráfia Azul;;em stock;novo;7,49;;;;;;1;7,49;;;;;;;;;;
237;Fita Ráfia Castanha;;em stock;novo;4,49;;;;;;18;4,49;;;;;;;;;;
238;Fita Ráfia Laranja;;em stock;novo;9,69;;;;;;13;9,69;;;;;;;;;;
239;Fita Ráfia Ouro;;em stock;novo;9,69;;;;;;12;9,69;;;;;;;;;;
240;Fita Ráfia Prata;;em stock;novo;7,49;;;;;;15;7,49;;;;;;;;;;
242;Fita Ráfia Amarela;;em stock;novo;7,49;;;;;;4;7,49;;;;;;;;;;
243;Fita Ráfia Preta;;em stock;novo;7,49;;;;;;0;7,49;;;;;;;;;;
244;Fita Ráfia Rosa;;em stock;novo;7,49;;;;;;1;7,49;;;;;;;;;;
245;Fita Ráfia Roxa;;em stock;novo;7,49;;;;;;1;7,49;;;;;;;;;;
246;Fita Ráfia Branca;;em stock;novo;4,49;;;;;;1;4,49;;;;;;;;;;
248;Laço Autocolante Mate Prata - Pack 100 un.;;em stock;novo;7,99;;;;;;0;7,99;;;;;;;;;;
250;Laço Autocolante Metalizado Ouro;;em stock;novo;10,49;;;;;;15;10,49;;;;;;;;;;
251;Laço Autocolante Metalizado Prata;;em stock;novo;10,49;;;;;;33;10,49;;;;;;;;;;
252;Laço Autocolante Metalizado Vermelho;;em stock;novo;10,49;;;;;;2;10,49;;;;;;;;;;
254;Laço Autocolante Metalizado Azul;;em stock;novo;13,49;;;;;;22;13,49;;;;;;;;;;
255;Laço Autocolante Papel Azul Claro;;em stock;novo;12,19;;;;;;7;12,19;;;;;;;;;;
256;Laço Autocolante Papel Branco;;em stock;novo;12,19;;;;;;6;12,19;;;;;;;;;;
257;Laço Autocolante Papel Ouro;;em stock;novo;12,19;;;;;;20;12,19;;;;;;;;;;
258;Laço Autocolante Papel Prata;;em stock;novo;12,19;;;;;;26;12,19;;;;;;;;;;
259;Laço Autocolante Papel Rosa Claro;;em stock;novo;12,19;;;;;;8;12,19;;;;;;;;;;
261;Laço Autocolante Papel Vermelho;;em stock;novo;12,19;;;;;;17;12,19;;;;;;;;;;
262;Laço Autocolante Wave Azul Petróleo;;em stock;novo;10,99;;;;;;8;10,99;;;;;;;;;;
263;Laço Autocolante Wave Prata;;em stock;novo;10,99;;;;;;3;10,99;;;;;;;;;;
264;Laço Autocolante Wave Vermelho;;em stock;novo;10,99;;;;;;26;10,99;;;;;;;;;;
265;Laço Puxar Papel Bobine Prata 40 peças;;em stock;novo;15,29;;;;;;10;15,29;;;;;;;;;;
268;Laço Puxar Papel Bobine Verde Claro 40 peças;;em stock;novo;15,29;;;;;;11;15,29;;;;;;;;;;
270;Laço Puxar Papel Bobine Vermelha 40 peças;;em stock;novo;15,29;;;;;;9;15,29;;;;;;;;;;
271;Laço Puxar Papel Bobine Bordeaux 30 mt;;em stock;novo;10,69;;;;;;13;10,69;;;;;;;;;;
272;Laço Puxar Papel Bobine Prata 30 mt;;em stock;novo;10,69;;;;;;5;10,69;;;;;;;;;;
273;Laço Puxar Brilho Vermelho;;em stock;novo;12,49;;;;;;35;12,49;;;;;;;;;;
274;Laço Puxar Metal Ouro;;em stock;novo;12,49;;;;;;59;12,49;;;;;;;;;;
275;Laço Puxar Metal Prata;;em stock;novo;12,49;;;;;;36;12,49;;;;;;;;;;
276;Laço Puxar Papel Azul;;em stock;novo;18,99;;;;;;4;18,99;;;;;;;;;;
277;Laço Puxar Papel Azul Petróleo;;em stock;novo;10,95;;;;;;28;10,95;;;;;;;;;;
278;Laço Puxar Papel Rosa;;em stock;novo;18,99;;;;;;2;18,99;;;;;;;;;;
279;Laço Puxar Papel Verde Alface;;em stock;novo;18,99;;;;;;6;18,99;;;;;;;;;;
280;Saqueta Bola de Berlim - Milheiro;;em stock;novo;8,3;;;;;;0;8,3;;;;;;;;;;
281;Saqueta Batata Frita - Milheiro;;em stock;novo;19,37;;;;;;2;19,37;;;;;;;;;;
282;Saqueta Corte de Feijão - Pack 100 un.;;em stock;novo;12,73;;;;;;177;12,73;;;;;;;;;;
283;Saqueta de Papel Kraft Branco - Pack 125 un.;;em stock;novo;1,2;;;;;;197;1,2;;;;;;;;;;
284;Saco para Pão - Saqueta Kraft Natural - Pack 100 un.;;em stock;novo;29,27;;;;;;2;29,27;;;;;;;;;;
285;Saco Papel Corte Feijão c/ Pala;;em stock;novo;7,26;;;;;;2;7,26;;;;;;;;;;
286;Saco Papel Gofrado Corte Feijão;;em stock;novo;8,12;;;;;;209;8,12;;;;;;;;;;
289;Saco Juta 1 Garrafa c/ Janela;garrafa, saco juta;em stock;novo;2,99;;;;;;645;2,99;;;;;;;;;;
295;Saco Juta 2 Garrafas c/ Janela;garrafa, saco juta;em stock;novo;4,21;;;;;;952;4,21;;;;;;;;;;
296;Saco Juta Claro;;em stock;novo;1,85;;;;;;782;1,85;;;;;;;;;;
297;Saco Juta Escuro;;em stock;novo;1,85;;;;;;1964;1,85;;;;;;;;;;
299;Saco Asa Torcida Natal Vermelho e Dourado;;em stock;novo;15,99;;;;;;255;15,99;;;;;;;;;;
302;Saco Asa Torcida Shiny Natal;;em stock;novo;9,23;;;;;;603;9,23;;;;;;;;;;
303;Saco Asa Torcida Brilho Vermelho;;em stock;novo;22,14;;;;;;61;22,14;;;;;;;;;;
304;Saco Asa Torcida Vermelho Estrelas;;em stock;novo;11,1;;;;;;81;11,1;;;;;;;;;;
305;Saco Asa Torcida Prata Brilho;;em stock;novo;22,14;;;;;;61;22,14;;;;;;;;;;
306;Saco Asa Torcida Ouro Brilho;;em stock;novo;22,14;;;;;;30;22,14;;;;;;;;;;
307;Saco Asa Torcida Branco Vertical;;em stock;novo;3,79;;;;;;750;3,79;;;;;;;;;;
308;Saco Asa Torcida Branco Horizontal;;em stock;novo;5,29;;;;;;83;5,29;;;;;;;;;;
309;Saco Asa Torcida Amarelo;;em stock;novo;5,15;;;;;;16;5,15;;;;;;;;;;
310;Saco Asa Torcida Azul;;em stock;novo;5,15;;;;;;29;5,15;;;;;;;;;;
311;Saco Asa Torcida Azul Claro;;em stock;novo;6,29;;;;;;39;6,29;;;;;;;;;;
312;Saco Asa Torcida Azul Escuro;;em stock;novo;5,15;;;;;;66;5,15;;;;;;;;;;
313;Saco Asa Torcida Castanho Chocolate;;em stock;novo;5,15;;;;;;67;5,15;;;;;;;;;;
314;Saco Asa Torcida Laranja;;em stock;novo;5,15;;;;;;122;5,15;;;;;;;;;;
315;Saco Asa Torcida Ouro;;em stock;novo;5,95;;;;;;155;5,95;;;;;;;;;;
317;Saco Asa Torcida Prata;;em stock;novo;5,95;;;;;;74;5,95;;;;;;;;;;
318;Saco Asa Torcida Preto Vertical;;em stock;novo;5,15;;;;;;118;5,15;;;;;;;;;;
319;Saco Asa Torcida Preto Horizontal;;em stock;novo;7,53;;;;;;1;7,53;;;;;;;;;;
320;Saco Asa Torcida Rosa;;em stock;novo;5,15;;;;;;37;5,15;;;;;;;;;;
321;Saco Asa Torcida Rosa Claro;;em stock;novo;6,89;;;;;;1;6,89;;;;;;;;;;
322;Saco Asa Torcida Roxo;;em stock;novo;5,15;;;;;;39;5,15;;;;;;;;;;
324;Saco Asa Torcida Verde Escuro;;em stock;novo;9,59;;;;;;39;9,59;;;;;;;;;;
325;Saco Asa Torcida Vermelho;;em stock;novo;5,15;;;;;;46;5,15;;;;;;;;;;
326;Saco Asa Torcida Natural;;em stock;novo;3,38;;;;;;554;3,38;;;;;;;;;;
327;Saco Asa Torcida Natural Verjurado;;em stock;novo;3,38;;;;;;66;3,38;;;;;;;;;;
328;Saco Asa Torcida Natural Natal;;em stock;novo;9,23;;;;;;16;9,23;;;;;;;;;;
329;Saco Asa Torcida Kraft Prata;;em stock;novo;5,49;;;;;;24;5,49;;;;;;;;;;
330;Saco Asa Torcida Kraft Prata Verjurado;;em stock;novo;5,49;;;;;;0;5,49;;;;;;;;;;
331;Saco Asa Torcida Kraft Preto;;em stock;novo;4,64;;;;;;8;4,64;;;;;;;;;;
332;Saco Asa Torcida Kraft Preto Verjurado;;em stock;novo;8,29;;;;;;6;8,29;;;;;;;;;;
333;Saco Asa Torcida Kraft Verde Garrafa Verjurado;;em stock;novo;4,69;;;;;;36;4,69;;;;;;;;;;
335;Saco Asa Torcida Kraft Vermelho;;em stock;novo;4,64;;;;;;11;4,64;;;;;;;;;;
337;Saco Asa Torcida Kraft Verjurado para 1 Garrafa;;em stock;novo;9,24;;;;;;966;9,24;;;;;;;;;;
338;Saco Asa Torcida Kraft Natural Liso 1 ou 2 Garrafas;;em stock;novo;7,79;;;;;;42;7,79;;;;;;;;;;
339;Saco Asa Torcida Branco Take Away;;em stock;novo;6,79;;;;;;12;6,79;;;;;;;;;;
340;Saco Asa Plana Kraft Take-Away;;em stock;novo;5,54;;;;;;90;5,54;;;;;;;;;;
346;Saco Plástico Asa de Tubo Transparente;;em stock;novo;2,46;;;;;;80;2,46;;;;;;;;;;
349;Papel de Embrulho - rolo padrão - 70 cm x 2 mt.;;em stock;novo;1,85;;;;;;50;1,85;;;;;;;;;;
353;Fita Organza Oslo;;em stock;novo;4,86;;;;;;15;4,86;;;;;;;;;;
357;Saco Plástico Corte Feijão Verde AD;;em stock;novo;7,38;;;;;;10;7,38;;;;;;;;;;
360;Saco Plástico Corte Feijão Amarelo BD;;em stock;novo;10,46;;;;;;17;10,46;;;;;;;;;;
363;Saco Plástico Branco c/ Asa Flexível Branca AD;;em stock;novo;7,38;;;;;;129;7,38;;;;;;;;;;
367;Saco Asa Torcida Kraft Natural Take Away;;em stock;novo;4,29;;;;;;156;4,29;;;;;;;;;;
371;Copos 4 OZ - Pack 50 un.;copo papel, copo, 4oz, café, copos;em stock;novo;1,57;;;;;;309;1,57;;;;;;;;;;
372;Copos 7 OZ - Pack 50 un.;copo papel, copo, copos, 7oz;em stock;novo;3,12;;;;;;180;3,12;;;;;;;;;;
373;Caixa Pastelaria - Pack 10 un.;caixa, pastelaria;em stock;novo;3,68;;;;;;204;3,68;;;;;;;;;;
375;Caixa de Cartão Kraft com Abas;caixa, cartão, embalamento, abas, envio;em stock;novo;11,22;;;;;;116;11,22;;;;;;;;;;
376;Caixa de Cartão Standard - Pack 10 un.;;em stock;novo;11,32;;;;;;60;11,32;;;;;;;;;;
382;Saco Plástico Corte Feijão Laços BD;;em stock;novo;22,14;;;;;;1;22,14;;;;;;;;;;
383;Saqueta de Papel Kraft Natural - Pack 125 un.;;em stock;novo;1,47;;;;;;161;1,47;;;;;;;;;;
384;Fita Organza;;em stock;novo;4,86;;;;;;197;4,86;;;;;;;;;;
385;Saco TNT com Corte Feijão - pack 25 un.;;em stock;novo;11,59;;;;;;11;11,59;;;;;;;;;;
386;Saco PP Woven Laminado Brilho;;em stock;novo;1,6;;;;;;855;1,6;;;;;;;;;;
390;Saco Kraft Natural - pack 10un.;;em stock;novo;4,8;;;;;;534;4,8;;;;;;;;;;
392;Tabuleiro para cabazes - packs 5 un.;;em stock;novo;7,45;;;;;;34;7,45;;;;;;;;;;
394;Envelopes Coex - Pack 125 un.;;em stock;novo;11,84;;;;;;28;11,84;;;;;;;;;;
398;Caixa Leitão - Pack 15 un.;leitão, caixa leitão;em stock;novo;17,53;;;;;;6;17,53;;;;;;;;;;
401;Caixa Dia da Mãe com Abas;;em stock;novo;1,79;;;;;;32;1,79;;;;;;;;;;
419;Saco Asa Torcida Kraft Branco Liso 1 ou 2 Garrafas;;em stock;novo;7,99;;;;;;35;7,99;;;;;;;;;;
